{
  "blockId": "btn_wm",
  "blockType": "shell.control.button.window_manager",
  "schemaVersion": "1.0.0",
  "data": {
    "label": "Windows",
    "icon": "layers",
    "interactions": {
        "click": {
            "kind": "openWindow",
            "params": { 
                "windowKey": "window_manager",
                "mode": "singleton"
            }
        }
    }
  }
}
