{
  "blockId": "btn_help",
  "blockType": "shell.control.button.help",
  "schemaVersion": "1.0.0",
  "data": {
    "label": "Help",
    "icon": "help-circle",
    "interactions": {
        "click": {
            "kind": "toggleOverlay",
            "params": { "overlayId": "help_overlay" }
        }
    }
  }
}
